faq_id,question,answer
F001,What are your delivery charges?,Delivery is free for orders above ₹499.
F002,How long does delivery take?,Orders are delivered within 3-5 working days.
F003,Can I cancel my order?,"Yes, you can cancel before it is shipped."
F004,Do you offer refunds?,Refunds are processed within 5-7 business days.
F005,What payment methods are accepted?,"We accept UPI, cards, and net banking."
F006,Do you have cash on delivery?,"Yes, COD is available for most locations."
F007,How can I track my order?,Use your order ID to check status in chat.
F008,What genres are available?,"We offer fiction, fantasy, finance, business, self-help, thriller, history, biography, sci-fi and more."
